{
  "meta": {
    "type": "cover_letter",
    "version": "1.0"
  },
  "sender": {
    "first_name": "Ramin",
    "last_name": "Yazdani",
    "position": "Bioinformatics Researcher",
    "address": "Saarbrücken, Germany",
    "mobile": "+49 123 456 789",
    "email": "ramin@example.com",
    "github": "Raminyazdani",
    "linkedin": "https://linkedin.com/in/raminyazdani"
  },
  "recipient": {
    "company": "TechCorp GmbH",
    "department": "Bioinformatics Division",
    "address_lines": ["Musterstraße 10"],
    "city": "10115 Berlin",
    "country": "Germany"
  },
  "job": {
    "title": "Computational Biology Engineer",
    "reference": "TC-BIO-2026-042",
    "location": "Berlin, Germany",
    "employment_type": "Full-time"
  },
  "letter": {
    "date": "2026-03-10",
    "title": "Application for Computational Biology Engineer",
    "opening": "Dear Hiring Committee,",
    "closing": "Best regards,",
    "enclosures": ["Curriculum Vitae", "Academic Transcripts"],
    "signature_name": "Ramin Yazdani"
  },
  "sections": [
    {
      "id": "motivation",
      "content": "I am writing to express my strong interest in the Computational Biology Engineer position at TechCorp GmbH, as advertised under reference TC-BIO-2026-042. With a background in biotechnology and bioinformatics, I am eager to contribute to your team's mission of advancing computational approaches in the life sciences."
    },
    {
      "id": "experience",
      "content": [
        "During my Master's studies in Bioinformatics at Saarland University, I developed end-to-end computational pipelines for multi-omics data integration, including metagenomics, transcriptomics, and proteomics workflows. These pipelines leveraged tools such as QIIME2, DESeq2, and custom Python scripts for automated quality control and statistical analysis.",
        "Prior to my current studies, I gained hands-on experience as a full-stack developer, building web applications and backend services using Python, Node.js, and React. This combination of software engineering and bioinformatics expertise positions me well for a role that bridges computational methods and biological research."
      ]
    },
    {
      "id": "skills",
      "content": "My technical skill set includes proficiency in Python, R, and Bash scripting, as well as experience with containerization (Docker), CI/CD pipelines (GitHub Actions), and cloud-based data processing. I am comfortable working with both SQL and NoSQL databases and have practical experience deploying reproducible analysis environments."
    },
    {
      "id": "closing_remarks",
      "content": "I am excited about the opportunity to bring my interdisciplinary background to TechCorp GmbH and would welcome the chance to discuss how my skills and experience align with your team's goals. I am available for an interview at your earliest convenience."
    }
  ],
  "options": {
    "template": "default",
    "color_theme": "darkgray",
    "show_photo": false
  }
}
