{
  "meta": {
    "type": "cover_letter",
    "version": "1.0"
  },
  "sender": {
    "cv_data_path": "../cvs/ramin_de.json",
    "position": "Bioinformatik-Forscher"
  },
  "recipient": {
    "company": "SAP SE",
    "department": "Health & Life Sciences",
    "person_name": "Herr Dr. Thomas Müller",
    "person_title": "Abteilungsleiter",
    "address_lines": ["Dietmar-Hopp-Allee 16"],
    "city": "69190 Walldorf",
    "country": "Deutschland"
  },
  "job": {
    "title": "Data Engineer – Life Sciences",
    "reference": "SAP-HL-2026-089",
    "location": "Walldorf, Deutschland",
    "posting_url": "https://jobs.sap.com/job/89012",
    "team": "Health & Life Sciences Data Platform",
    "start_date": "2026-07-01",
    "employment_type": "Vollzeit"
  },
  "letter": {
    "date": "2026-03-10",
    "title": "Bewerbung als Data Engineer – Life Sciences",
    "opening": "Sehr geehrter Herr Dr. Müller,",
    "closing": "Mit freundlichen Grüßen,",
    "enclosures": ["Lebenslauf", "Zeugnisse", "Publikationsliste"],
    "signature_name": "Ramin Yazdani",
    "language": "de"
  },
  "sections": [
    {
      "id": "motivation",
      "content": "mit großem Interesse habe ich Ihre Stellenausschreibung für die Position Data Engineer – Life Sciences (Referenz SAP-HL-2026-089) gelesen. Die Verbindung von Datenengineering und Lebenswissenschaften bei SAP entspricht genau meinem beruflichen Profil und meinen Karrierezielen."
    },
    {
      "id": "academic_background",
      "content": [
        "Derzeit absolviere ich meinen Master in Bioinformatik an der Universität des Saarlandes, wo ich mich auf die Integration von Multi-Omics-Daten spezialisiert habe. Meine Forschungsarbeit umfasst die Entwicklung automatisierter Pipelines für metagenomische und transkriptomische Analysen mit Python, R und Nextflow.",
        "Zuvor habe ich einen Master in Biotechnologie an der Universität Teheran abgeschlossen, wo ich fundierte Kenntnisse in molekularbiologischen Methoden und Versuchsplanung erworben habe."
      ]
    },
    {
      "id": "technical_skills",
      "content": "Meine technischen Kompetenzen umfassen Python, R und Bash für wissenschaftliches Rechnen, Erfahrung mit Datenbanksystemen (PostgreSQL, MongoDB), Containerisierung (Docker, Kubernetes) sowie CI/CD-Workflows mit GitHub Actions. Als freiberuflicher Full-Stack-Entwickler habe ich produktionsreife Datenverarbeitungssysteme aufgebaut und gewartet."
    },
    {
      "id": "company_fit",
      "content": "SAPs Engagement im Bereich Health & Life Sciences und die Entwicklung cloudbasierter Datenplattformen für das Gesundheitswesen begeistern mich besonders. Meine Erfahrung in der Entwicklung skalierbarer Bioinformatik-Workflows und mein Verständnis biologischer Datenstrukturen würden einen wertvollen Beitrag zu Ihrem Team leisten."
    },
    {
      "id": "closing_remarks",
      "content": "Über die Einladung zu einem persönlichen Gespräch würde ich mich sehr freuen. Ich stehe Ihnen ab Juli 2026 zur Verfügung und bin jederzeit für ein Vorstellungsgespräch erreichbar."
    }
  ],
  "options": {
    "template": "default",
    "layout_variant": "standard",
    "color_theme": "red",
    "show_photo": true
  }
}
